{"contractVersion":"0.1.0","jobId":"job_req1","stage":"script","projectId":"prj_demo","chapterId":"chp_demo","sourceVersionId":"srcv_demo","upstreamConfirmedVersionIds":["cv_knowledge"],"scopeKeys":["scene:1"],"generationParameters":{"targetDurationSeconds":60,"aspectRatio":"9:16","narrativeMode":"narration"},"input":{"sourceFragments":[{"id":"frag_demo","text":"少年推门而入。"}],"confirmedUpstreamContent":[{"id":"fact_demo"}],"approvedAdditionIds":[],"lockedItemIds":[]}}
